"","text","schooltype","T3F_54","id"
"433","Een op de vijf mensen heeft last van hooikoorts en het aantal groeit drastisch Volgens een woordvoerder van Kleenex zijn de uitspraken gebasseerd op eigen onderzoek dat uitsluitend voor intern gebruik is en niet kan worden gedeeld Het blijkt echter bijzonder lastig om een schattting te maken van het aantal mensen met hooikoorts In Nederland verzamelt het CMR door huisartsen gediagnosticeerde gevallen van hooikoorts Die bieden echter geen uitstel over prevalentie onder de gehele bevolking omdat lang niet iedereen de huisarts bezoekt Het is al met al niet mogelijk om de prevalentie van hooikoorts te bepalen Ook omdat de bronnen van Kleenex zich op zegt te baseren niet controleerbaar zijn Het interne onderzoek van Kleenex is niet inzichtelijk gemaakt","havo",8,433
"434","Kleenex beweert dat op de mensen hooikoorts heeft Echter Kleenex heeft deze informatie uit eigen onderzoek waarbij de informatie uit artikelen is gehaald die niet recentelijk zijn Kleenex beweert cijfers van hooikoorts te hebben van het KNMI alleen deze heeft daar geen cijfers van Daarbij is het lastig om een schatting te maken want niemand houdt de aantallen bij Ook meldt niet iedereen zich bij de huisarts voor hooikoorts waardoor het sowieso niet mogelijk is om de cijfers van hooikoorts te bepalen De bronnen van Kleenex zijn daarbij niet controleerbaar wat dus onbetrouwbaar maakt Ook de bewering dat er een verdubbeling heeft plaats gevonden klopt niet aangezien er sinds geen groei bij de huisartsen is geconstateerd Kleenex bewering is dus duidelijk ongefundeerd","havo",10,434
"435","Bewering Kleenex op de mensen hebben last van hooikoorts en dat groet dramatisch deze bewering is volgens nextcheckt ongefundeerd redenen Het is lasting om een schatting te maken van aantal patienten die hooikoorts hebben want de klachten zijn seizonsgebonden en varieren per jaar Niemand houdt het bij in constateerde World Allery Organization dat procent ademhalingsallergie heeft Maar welk aandeel hooikoorts daarin had is onbekend CMR verzamelt sinds door huisartsen geconstateerde gevallen van hooikoorts maar omdat lang niet iedereen naar de dokter gaat bied dit geen uitsluitsel niet genoeg ruimte ","havo",7,435
"436","De uitspraken zijn gebaseerd op eigen onderzoek en kan niet worden gedeeld Er worden ook cijfers gebruikt die de bron zelf niet kent Bovendien is het lastig een schatting te maken aangezien de klachten seizoensgebonden en varieren per jaar Het is ook onduidelijk wanneer er sprake is van hooikoorts en er wordt geen onderscheid gemaakt tussen hooikoorts en andere vormen De bronnen die ze gebruiken zijn ook niet controleerbaar","havo",6,436
"437","De bewering is gebasseerd op verschillende onderzoeken maar er valt niet meer te achterhalen of deze kloppen Verder zou het onderzoek ook slecht te meten zijn door verschillende factoren","havo",0,437
"438","Een europees onderzoek heeft uitgewezen dat er een stijging is van tot procent Vaak worden er ook andere ziektes benoemd tot hooikoorts terwijl het niet in dat seizoen plaats vindt Bij het RIVM wordt geen onderscheidt gemaakt tussen hooikoorts en andere ziektes en bij De World Allergy Orgazization is het niet alleen in Nederland","havo",2,438
"439","Het persbericht van Biohorma spreekt van een stijging van het aantal hooikoortspatienten in Nederland Het KNMI herkent deze cijfers niet ze hebben helemaal geen hooikoortscijfers Het is ook moeilijk om het aantal hooikoortpatienten te tellen aangezien de klachten seizoensgebonden zijn en verschillen per jaar Het is niet mogelijk om de prevalentie van hooikoorts in Nederland te bepalen Ook Kleenex zegt dat hun bronnen op niks te basseren zijn Op grond van al deze gegevens beoordeelt next checkt de uitspraak als ongefundeerd","havo",5,439
"440","Volgens Nextcheckt zijn de uitspraken gebaseerd op eigen onderzoek Ze hebben hun uitslagen Van EACCI maar die bestaat niet meer en ze kennen die cijfers helemaal niet Je kan ook moeilijk een schatting maken van het aantal mensen met hooikoorts Want niemand houd de aantallen bij de klachten zijn seizoensgebonden varieren per jaar doktersbezoek is niet nodig en medicijnen zijn zonder recept te verkrijgen Je hebt ook op hooikoorts lijkende klachten De bronnen waar Kleenex zich op zegt te basseren zijn niet controleerbaar","havo",10,440
"441","Een op de vijf mensen heeft hooikoorts en het aantal stijgt drastisch Zakdoekjesproducent Kleenex laat weten dat Hooikoorts op zijn hoogtepunt is Dit is volgens de redactie nextcheckt ongefundeerd Volgens de woordvoerder van Kleenex zijn de uitspraken gebasseerd op eigen onderzoek De bewering van Kleenex is tweedelig Ten eerste een op de vijf Nederlanders heeft last van hooikoorts en ten tweede dat aantal groeit drastisch Het blijkt echter bijzonder lastig te zijn om een schatting te maken van het aantal mensen met hooikoorts","havo",4,441
"442","de stelling is ongefundeerd omdat sommige bronnen waar de bewering op gebaseerd is zijn niet meer te achterhalen Sommige zeggen dat ze de cijfers nooit hebben gehad het is onduidelijk te zien of iemand hooikoorts heeft of de simtomen ervan Ook niet iedereen meld zich bij de huisarts want je kan de medicijnen gewoon bij de appotheek krijgen Ze hebben ook cijfers uit finland gebruikt maar die kunnen in NL natuurlijk heel anders zijn op de grond van al deze gegevens beoordeelt nextcheckt de uitspraak als ongefundeerd","havo",7,442
"443","Een op de vijf mensen heeft last van hooikoorts en dit aantal groeit drastisch procent Van de Nederlanders heeft last van hooikoorts Het is een groot groeiend probleem Het persbericht Van Biohorma spreekt van een stijging van het aantal hooikoortspatienten in Nederland Van procent in naar in In waren op de vrouwen en op de mannen door een huisarts met hooikoorts gediagnosticeerd In waren dat er Respectievelijk en dat kan erop wijzen dat het aantal mensen met hooikoorts in Nederlands de afgelopen jaren toenam","havo",2,443
"444","Mensen met hooikoorts nemen toe Melde dagblad Spits als reclame op zakdoekjes Dit klopt niet volgens nextcheckt Het bedrijf kleenex beweerde dit op eigen onderzoek Hieruit zou blijken dat de patienten met tot stijgen ieder jaar Kleenex heeft gelijk in zijn nummers Maar dit is onmogelijk bij te houden Ze gokte maar wilde weg Mensen weten niet eens of ze hooikoorts hebben Er is geen medicijn voor en dokters weten het ook niet De bronnen van kleenex kloppen dus niet en zijn niet te controlerenOp grond hiervan zegt nextcheckt dat deze uitspraak ongefundeerd is","havo",3,444
"445","Kleenex zegt dat van de mensen hooikoorts heeft en dat dit verdubbeld maar dit is uit eigen onderzoek met de University of Worchester dat uitsluitend voor eigen gebruik is EAACI zegt deze cijfers niet te herkennen Ze hebben ook de KNMI ingeschakeld maar die beweert geen hooikoortscijfers te hebben Ook zijn er twee verschillende types dus heel duidelijk is het niet waarover het gaat Veel mensen bezoeken de dokter ook niet dus de cijfers zijn daarom ook onduidelijk Er zijn wel meer mensen met hooikoorts maar het dubbele is onwaarschijnlijk Voor Nederland zijn er ook geen accurate cijfers dus de uitspraak is ongefundeerd","havo",11,445
"446","hooikoorts bereikt niet haar hoogte punt het is slechtsmet gestegen ten opzichte van vorig jaar er kan niet goed beoordeeld worden hoeveel mensen echt hooikoorts hebben omdat medicijnen overal te krijgen zijn Het Nationaal kompas Volksgezondheid van het RIVM schat op basis van bevolkingsonderzoek dat ongeveer van de bevolking neus allergie heeft waaronder hooikoorts valt","havo",3,446
"447","Volgens Kleenex zou een op de vijf mensen last hebben van hooikoorts Nextcheckt beweert deze uitspraak als ongefundeerd omdat De bronnen die werden geraadpleegd EAACI en KNMI hebben beide geen geldige cijfers geproduceerd En als er geldige cijfers werden geproduceerd zouden deze simpel maar jaar geldig zijn omdat het per jaar verschilt van klachten","havo",4,447
"448","Nextckeck vindt de bewering van Kleenex ongefundeerd dat zou wel is kunnen kloppen Want Kleenex wilt de onderzoeksresultaten niet vrijgeven en dus kan niemand het checken Ook gebruikt Kleenex als bron gezondheidsnetnl waar ook onderzoeksresultaten op zouden staan en zij geven dan weer als Bron een site die niet meer bestaan en de andere site kent die cijfers niet Ook is het moeilijk te checken wie hooikoorts heeft want die cijfers worden niet bijgehouden Want hooikoorts is Seizoensgebonden een bevolkingsonderzoek maakt duidelijk dat eenderde van Nederland neusallergie heeft maar daar wordt geen onderscheidt gemaakt tussen allergieen dus Kleenes kan niet met zekerheid zeggen dat hun uitspraak klopt en hun argumenten zijn gebaseerd op bronnen die niet te checken zijn","havo",11,448
"449","Als bron worden de EAACI en allergiesitenl genoemd Die laatste bestaat niet langer en een woordvoerder van het EAACI zegt het cijfer niet te herkennen Het bericht van Biohorma spreekt van een stijging van het aantal hooikoortspatienten in Nederland De bron is van het KNMI Maar het KNMI zegt die cijfers niet te hebben Het blijkt bijzonder lastig om een schatting te maken van het aantal mensen met hooikoorts Niemand houdt die aantallen bij want de klachten zijn seizoensgebonden en varieren per jaar De echte reactie moet worden onderscheiden van op hooikoorts lijkende klachten die het hele jaar voorkomen Het is al met al niet mogelijk om de prevalentie van hooikoorts in Nederland te bepalen","havo",11,449
"450","De uitspraak van Kleenex klopt wel omdat het RIVM schat dat van de Nederlanders hooikoorts heeft En een organisatie in Finland heeft bewezen dat van de bevolking hooikoorts zou hebben En de uitspraak een op vijf klopt Het CMR rapporteert ook dat er een stijging is van de hooikoorts gevallen Dus Kleenex heeft op sommige punten wel degelijk gelijk","havo",3,450
"451","Volgens Spits en Kleenex heeft het aantal mensen met hooikoorts een hoogtepunt bereikt Uit onderzoek van Nextcheckt blijkt dat de cijfers die ze hebben vaak niet gecontroleerd en ongefundeerd zijn Het aantal mensen met hooikoorts is moeilijk te checken omdat het seizoensgebonden is en de medicijnen zonder doktersvoorschrift te verkrijgen zijn In landen als Finland zijn er wel veel mensen met hooikoorts maar dat zegt niets over Nederland Niet iedereen met hooikoorts gaat naar de dokter dus er zijn geen goede bijgehouden aantallen Het aantal mensen dat wel naar de dokter gaat is over de periode wel gestegen Hieruit kan je opmaken dat er misschien wel een stijging was maar dat er geen harde feiten en getallen zijn Ongefundeerd dus","havo",7,451
"452","Dat een op de vijf mensen hooikoorts Heeft en het aantal blijft stijgen is ongefundeerd volgens nextcheckt Deze uitspraak is gebaseerd op eigen onderzoek dat uitsluitend voor intern gebruik is Ook wordt er als bron genoemd EAACI dat niet langer bestaat en het cijfer niet weet te herkennen de Bronnen waar kleenex zich op zegt te beseren zijn niet controleerbaar dat gaat over hoeveel mensen hooikoorts heeft Wel kan er worden gekeken of hooikoorts toeneemt maar een verdubbeling in de laatste jaar is onwaarschijnlijk vanaf Het jaar neemt de groei van het aantal bij de huisarts geregistreerde gevallen af","havo",7,452
"453","Een op de vijf mensen heeft hooikoorts en dit aantal groeit drastisch dat zijn Kleenex zijn woorden dit wordt echter ongefundeerd verklaard Niemand houd de exacte getallen bij in Nederland en in de EU was er een toename van tot procent in tegenstelling tot de verdubbeling in jaar van Kleenex Ook is er onderscheid tussen ademhalingsallergie en hooikoorts hooikoorts is maar een onderdeel van ademhalings allergie Het is zeer onwaarschijnlijk dat er in de afgelopen jaar een verdubbeling is plaats gevonden want het aantal geregistreerde gevallen is juist afgenomen ipv toegenomen Met als conclusie dat de bewering ongefundeerd en dus niet als waarheid kan worden gezien","havo",5,453
"454","Nadat ik me goed heb gedocumenteerd te hebben op het onderwerp hooikoort kwam er duidelijk naar voren dat er wel degelijk een schatting tot vrij nauwkeurig bepaald kan worden naar de cijfers voor hooikoorts Dit zijn deels eigen onderzoeken die juist wel vrij nauwkeurig zijn en niet zomaar iets uit de duim zijn gezogen Deze onderzoeken worden weer ondersteunt door andere samenwerkingsverbanden waardoor er nauwkeurige cijfers naar voren kunnen komen Ook hebben we organisatie erbij geboeid die al deze gegevens verzamelen bijvoorbeeld het Continue Morbiditeitsregistratie die al vanaf gegeven verzameld van gediagnosticeerde hooikoorts gevallen","havo",2,454
"455","De bewering van Kleenex is ongefundeerd omdat volgens een woordvoerder van Kleenex deze uitspraak is gebaseerd op eigen onderzoek en alleen voor intern gebruik Als bron hiervoor wordt een site genoemd die niet meer bestaat en EAACI zegt deze cijfers niet te herkennen Ook zal het KNMI een bron zijn maar deze hebben hier geen cijfers van Het is ook moeilijk te bepalen hoeveel mensen last hebben van hooikoorts Niemand houd de aantallen bij want de klachten zijn seizoensgebonden en varieren per jaar Ook niet iedereen bezoekt de huisarts omdat medicijnen zonder recept verkrijgbaar zijn Er zijn dus geen cijfers over het aantal mensen met hooikoorts en het onderzoek van Kleenex is alleen intern","havo",11,455
"456","De bewering van Kleenex is ongefundeerd omdat er geen goede schatting gedaan kan worden naar het aantal hooikoortspatienten Velen bezoeken hun huisarts niet en kunnen medicijnen zonder recept afhalen Daarnaast zijn de klachten seizoensgebonden en houd niemand de aantallen bij Ook is er geen term voor hooikoorts er word namelijk geen onderscheid gemaakt tussen een ademhalingsallergie en hooikoorts Voor het onderzoek beweerde Kleenex gebruik te maken van een niet meer bestaande site","havo",6,456
"457","De bronnen die zakdoekjesproducent Kleenex gebruikt zijn niet betrouwbaar Zo werd de site Allergiesitenl als bron genoemd terwijl deze site nieteens meer bestaat en bij andere instanties zoals Het KNMI worden de cijfers niet herkent Het aantal patienten is onbetrouwbaar aangezien hooikoorts seizoengebonden is en doktersbezoek is vaak onnodig Soms word het begrip hooikoorts ook verward met andere allergien De bronnen van Kleenex zijn ook niet controleerbaar Er kan dus getwijfeld worden aan de betrouwbaarheid","havo",9,457
"458","Het aantal mensen met hooikoorts stijgt dramatisch wordt verteld door een bedrijf Dit is nader onderzocht maar het klopt niet De uitspraken zijn gebasseerd op eigen onderzoek Ook zijn de bronnen niet goed de ene bron bestaat niet en de andere bron klopt niet want dit is nextcheck nagegaan Ook is de bewering van Kleenex delig De resultaten kunnen misschien ook van andere neusallergien zijn Niet alle mensen die last hebben van hooikoorts staan geregisteerd dus is moeilijk na te trekken wie het heeft Wel kan worden gekeken of het aantal diagnoses van hooikoorts toeneemt ","havo",5,458
"459","Er worden naar bronnen verwezen die niet meer bestaan of die niks doen met cijfers over hooikoorts Ook wordt er naar percentages verwezen van allergienproblemen maar daaruit blijkt niet welk deel met hooikoorts te maken heeft Andere bronnen die Kleenex gebruikt kan men niet controleren Een andere reden is dat vanaf de groei van het aantal bij de huisarts geregistreerde gevallen afneemt","havo",5,459
"460","Er word gezegt dat een op de vif mensen last heeft van hooikoorts Maar is dat wel zo Er zijn nergens echte cijfers te vinden over het aantal mensen met hooikoorts Er wordt gebasseerd op basis van schattingen Veel mensen hebben een neusallergie dit hoeft niet te betekenen dat je hooikoorts hebt Het aantal mensen dat hooikoorts hebben is dus onbekend en de bewering van Kleenex is dus ongefundeerd","havo",5,460
"461","Bij het doen van deze uitspraak beweert Kleenex onderzoek gedaan te hebben Dit is misschien waar alleen dit is niet onderzocht door en bij verantwoorde bronnen Een van de bronnen bestaat al niet meer en de ander beweert niet eens mee te hebben gedaan Het is dus misschien wel onderzocht maar niet erkend onderzocht in ieder geval De bewering dat er een verdubbeling van hooikoortspatienten is in de laatste jaar word zelfs als onwaarschijnlijk beweren door een betrouwbare bron Het is dus wel duidelijk dat Kleenex geen goed voorwerk heeft gedaan voor het uitbrengen van deze beweringen","havo",6,461
"462","De bewering van Kleenex is ongefundeerd Zo zijn de bronnen niet juist of worden er gegevens gebruikt die de bronnen niet kennen Daarnaast is het haast onmogelijk om een schatting te maken van het aantal mensen met hooikoorts Ook is de definitie van hooikoorts soms niet helemaal duidelijk en is er geen verdubbeling in de laatste jaren mogelijk omdat dit aantal vanaf juist afneemt","havo",6,462
"463","Hoe betrouwbaar is de uitspraak Een op de vijf mensen heeft last van hooikoorts en dat aantal groeit drastisch Deze bewering is ongefundeerd omdat deze uitspraak gebaseerd is op eigen onderzoek daarnaast worden de resultaten niet gedeeld wat de betrouwbaarheid niet ten goede komt Een van de bronnen die voor het onderzoek zijn gebruikt bestaat niet meer daarnaast wordt er in een bron beweert dat een woordvoerder van het KNMI spreekt van een stijgend hooikoortspercentage echter het KNMI zegt geen hooikoortspercentages te kennen De schatting naar het aantal hooikoortspatienten is lastig omdat deze niet altijd langs een dokter hoeven De bronnen waar Kleenex zich op zegt te baseren zijn niet controleerbaar","havo",9,463
"464","De uitspraak is gebaseerd op eigen onderzoek van Kleenex Dit onderzoek is ook alleen voor intern gebruik en wordt dus niet naar buiten gebracht Ook gebruikt het onderzoek van Kleenex geen betrouwbare en soms geen bruikbare bronnen De cijfers in de bronnen worden niet herkend Ook klopt de schatting van het aantal hooikoorts patienten niet Deze is namelijk niet duidelijk bij te houden en varieren ieder jaar Het is daardoor niet mogelijk om een prevalentie van Hooikoorts in Nederland te bepalen De uitspraak een op vijf van Kleenex zijn dus onjuist ook komt de voorspelde verdubbeling niet uit maar neemt het aantal mensen met hooikoorts juist af","havo",8,464
"465","De bronnen kloppen niet ze hebben zelf cijfers bedacht Niemand kan vaststellen of deze kloppen Ze zeggen dat op de er last van heeft terwijl niemand een exact aantal weet","havo",1,465
"466","Een op de vijf mensen heeft last van hooikoorts en dat aantal groeit drastisch De redactie van nextcheckt zoekt het uit Klopt dit Nee nextcheckt vindt de bewering ongefundeerd Volgens Kleenex zijn de resultaten gebaseerd op eigen onderzoek De cijfers worden door het EAACI en het KNMI niet herkent Ook is het bijzonder lastig een schatting te maken als het gaat om het aantal hooikoortspatienten Het CMR verzameld gegevens over mensen met gediagnosticeerde hooikoorts terwijl niet iedereen naar de huisarts gaat Wel kan er worden gekeken of het aantal diagnoses toe neemt en dat is zo Maar verdubbeling in de laatste jaar is onwaarschijnlijk Op grond van deze gegevens beoordeelt nextcheck de uitspraak ongefundeerd","havo",9,466
"467","Kleenex beweert dat een op de vijf mensen last heeft van hooikoorts en dat aantal groeit drastisch De redactie van nextcheckt vind de bewering van Kleenex ongefundeerd Dit komt doordat het onderzoek niet wordt vijgegeven Ook basseerd Kleenex zich op een tweetal bronnen maar als de bronnen gecheckt worden komen de cijfers hen niet bekend voor Hier komt bij dat je medicijnen voor hooikoorts kan krijgen zonder doktersvoorschrift Velen mensen gebruiken deze medicijnen terwijl ze net zo goed een andere allergie kunnen hebben Als laatste neemt de groei van het aantal bij huisarts geregistreerde gevallen af","havo",6,467
"468","De bewering dat een op de vijf mensen last heeft van hooikoorts en dit aantal drastisch groeit is niet waar Ten eerste is het erg lastig om een schatting te maken van het aantal mensen met hooikoorts omdat de klachten seizoensgebonden zijn en per jaar varieren De cijfers dat procent last heeft van hooikoorts zijn onderzocht door EAACI en de Allergiesitenl maar de laatste bestaat niet langer en een woordvoerder van het EAACI zegt het cijfer niet te herkennen De World Allergy Organization heeft onderzocht dat in Nederland procent een ademhalingsallergie heeft maar het aandeel hooikoorts is niet apart bekeken Ook bezoekt niet iedereen de huisarts met hooikoortsklachten dus kan er geen percentage worden berekent","havo",8,468
"469","Volgens nextcheckt is het onjuist dat het aantal hooikoorts patienten groeit Er blijken gegevens te zijn gebruikt die niet langer van invloed zijn Ook zijn er gegevens gebruikt die niet van toepassing zijn in Nederland Niemand houdt de hooikoorts stijging bij en de klachten zijn seizoensgebonden en varieren per jaar Het onderzoek is dus gewoon niet proffesioneel gegaan en er zijn onjuiste gegevens gebruikt","havo",3,469
"470","Gezondheidsnetnl beweert dingen zonder dat zij feitelijke cijfers hebben de zogenaamde bron van de site beweert de cijfers niet de herkennen Ook andere bronnen zoals het persbericht van biohorma blijken geen feitelijke informatie de bevatten","havo",6,470
"471","Een op de vijf mensen heeft last van hooikoorts Dit is in de laatste jaren drastisch gestegen Ongeveer van de Nederlanders heeft last van hooikoorts Vooral min het voorjaar hebben ze er last van Het is sinds de laatste jaar zelfs verdubbeld Maar wat is hooikoorts eigenlijk Dit is een reactie op de grassen pollen en stuifmeel die vooral in de lente voorkomen Er zijn een aantal dokters die zich bezig houden met het registreren van het aantal hooikoorts patienten zin onleesbaar In waren op vrouwen aantal woorden onleesbaar gediagnosticeerd met hooikoorts ","havo",1,471
"472"," van de tekst is onleesbaar Eerste zin Het aantal mensen dat last heeft van hooikoorts groeit drastisch althans dat Laatste zin Het is inderdaad waar dat het aantal personen met hooikoorts groter is maar een verdubbeling is zeer onwaarschijnlijk","havo",4,472
"473","De geraadpleegde bron Allergiesitenl bestaat niet meer en de woordvoerder van EAACI zegt het cijfer van de Nederlanders heeft last van hooikoorts niet te herkennen Ook is het heel lastig om een schatting te maken van mensen met hooikoorts Vaak wordt er geen onderscheid gemaakt tussen hooikoorts en ander neus allergieen waardoor de cijfers niet zeker zijn Niet iedereen bezoekt de huisarts dus op grond daarvan kan ook niet bepaald worden hoeveel mensen in Nederland last hebben van hooikoorts","havo",7,473
"474","Kleenex zegt een op de vijf mensen heeft hooikoorts en dat aantal stijgt drastisch Deze bewering is ongefundeerd want ten eerste de bronnen die Kleenex heeft gebruikt zijn een artikel van Gezondheidnetnl en een persbericht van Biohorma In het artikel staat dat procent van de Nederlanders last heeft van hooikoorts de bron die hier vermeld wordt EAACI zegt hier niks van te weten en de andere bron Allergiesitenl bestaat niet meer Het persbericht van Biohorma vertelt over een stijging van naar bij nederlanders Als bron staat vermeld KNMI deze zegt er ook niks van te weten Ten tweede hooikoorts is moeilijk te meten hooikoorts is seizoensgebonden en doktersbezoek vaak niet nodig Als laatste word hooikoorts meegenomen met neusallergie en niet apart het is dus niet specifiek gemeten onleesbaar","havo",10,474
"475","De uitspraken van Kleenex zijn gebaseerd op eigen onderzoek dat uitsluitend voor intern gebruik is Als bron werden de EAACI en Allergiesitenl gebruikt terwijl dat laatste niet meer bestaat Een woordvoerder maakte bekend dat hij de gebruikte cijfers niet herkent De bewering van Kleenex klopt ook niet volledig want hooikoorts is seizoensgebonden en kan dus elk jaar bij iedereen verschillen Er zijn dus daarom geen accurate cijfers geschikbaar","havo",8,475
"476","De bewering van Kleenex luid Een op de vijf mensen heef last van hooikoorts en dat aantal groeit drastisch Het oordeel van next checkt is dat de bewering ongefundeerd is Niemand houft het aantal van de personen met hooikoorts bij de sites die Kleenex geeft zijn oncontroleerbaar of men herkent de cijfers niet Veel onderzoeken zijn ook niet gedaan van hooikoorts Veel van de onderzoeken zijn breder dan hooikoorts Veel mensen weten zelf niet eens wat hooikoorts nou precies is Al met al wordt het dus heel moeilijk om vast te stellen of een op de vijf mensen het hebben","havo",4,476
"477","Voor de Nederlandse cijfers heeft Kleenex ook een tweetal andere bronnen geraadpleegd een artikel uit van Gezondheidsnetnl en een persbericht van Biohorma Als bron in het artikel van Gezondheidsnetnl worden de EAACI en Allerigiesitenl genoemd De laatste bestaat niet langer en een woordvoerder van EAACI zegt het cijfer niet te herkennen Het persbericht van Biohorma spreekt van een stijging De bron is volgens een woordvoerder het KNMI maar ze zeggen geen hooikoortscijfers te hebben De bronnen waar Kleenex zich op zegt te baseren zijn niet controleerbaar En het is bijzonder lastig om een schatting te maken van het aantal mensen met hooikoorts Niemand houdt de aantallen bij want de klachten zijn seizoensgebonden en varieren per jaar","havo",9,477
"478","Kleenex komt aan haar gegevens door eigen niet voor de buitenwereld bestemd onderzoek Daarnaast hebben ze de bronnen gezondheidsnetnl en een persbericht van Biohorma geraadpleegd De gegevens van gezondheidsnetnl komen van een site die niet bestaat en van het EAACI dat onkent het hooikoortscijfer te herkennen Biohorma zegt haar cijfers van het KNMI te hebben maar het KNMI weet hier niks vanaf Het is lastig een goede schatting te maken van het aantal hooikoortspatienten In onderzoeken wordt wel gekeken naar het aantal mensen met allergieen maar niet naar hooikoorts specifiek Ook de onderzoeken van het CMR bieden geen correcte informatie omdat de prevalentie niet goed te bepalen is Recentere data dan van is dan ook niet beschikbaar","havo",13,478
