"","text","schooltype","T3F_54","id"
"185","Kleenex publiceerde in het dagblad Spits de volgende bewering Een op de vijf mensen heeft last van hooikoorts en dat aantal groeit drastisch Nextcheckt oordeelde hierover dat de bewering van Kleenex ongefundeerd zou zijn Allereerst zouden de argumenten die Kleenex gaf niet kloppen De twee bronnen die gebruikt werden voor de advertentie bleken zelf niet over cijfers over hooikoorts te beschikken Daar komt bij dat de andere belangrijke organisaties met betrekking tot ademhalingsallergie eberhaupt nog nooit cijfers hebben ebereknd die alleen maar over hooikoorts gaan Volgens het CMR is het namelijk heel moeilijk te meten omdat langs niet iedereen zich bij een dokter meldt Het CMR rapporteert ook dat een stijging van het aantal gediagnosticeerde hooikoortgevalen het geval is maar een verdubbeling is onwaarschijnlijk Op grond van al deze gegevens beoordeelt nextcheckt de uitspraak van Kleenex ongefundeerd","vwo",7,185
"186","Volgens nextcheckt is de bewering van Kleenex ongefundeerdDe motievering van dit oordeel begint met te stellen dat de gebruikte cijfers van de eerste bron neit betrouwbaar zijn omdat de bestgenoemde bron niet meer bestaat en een worrdvoerder van de andere bron zegt de cijfers niet te herkennen Ook de cijfers van de tweede bron blijken onbetrouwbaar Deze bron zou namelijk het KNMI als bron gebruikt hebben maar deze geeft aan geen hooikoortscijfers te hebben Vervolgens stelt nextcheckt dat hooikoortscijfers in het algemeen lastig te verkrijgen zijn Er zijn wel cijfers van registraties door artsen maar niet iedere hooikoortspatient gaat naar een arts toeop basis vand deze argumenten vindt nextcheckt dat de bewering van Kleenex ongefundeerd is Een op de vijf mensen heeft last van hooikoorts en dat aantal groeit drastisch","vwo",8,186
"187","de redactie beoordeeld de bewering als ongefundeerd Het blijft echter bijzonder lastig om een schatting te maken van het aantal mensen met hooikoorts het RIVM schat dat eenderde van de bevolking last heeft van neusallergie maar dat daarbij geen onderscheid wordt gemaakt tussen verschillende vormen De schatting biedt dus geen uitsluitsel het CMR verzamelt sinds door huisartsen gedignosticeerde gevallen van hooikoorts dit biedt echter weer geen uitsluitsel omdat lang niet iedereen de huisarts bezoekt wegens hooikoortsklachten Dat er verdubbeling in de laatste jaar zou hebben plaatsgevonden is echter onwaarschijnlijk Vanaf neemt de groei van het aantal bij de huisarts geregistreerde gevallen af","vwo",6,187
"188","Kleenex beweerteen op de vijf mensen heeft last van hooikoorts De redactie van nextcheckt vindt deze bewering ongefundeerd vanwege de volgende punten de resultaten van het interne onderzoek van kleenex worden niet openbaar gemaakt de bron van het gezondheidsnetnl bestaat niet meet en de bron van onbekend woord het KNMI zegt geen hooikoortscijfers te kennenwel een feit is dat het aantal door het CMR geregistreerde gediagnoticeerde hooikoortspatienten is gestegen Maar daar staat tegenover dat het aantal geregistreerde gevallen bij de huisarts sinds is afgenomen hierdoor lijkt een verdubbeling in de afgelopen jaar erg onwaarschijnlijk al met al heeft de redactie van nextcheckt een aantal goede argumenten om de bewerin gvan kleenex ongefundeerd te noemen","vwo",11,188
"189","Kleenex heeft verschillende bronnen geraadpleegd om tot deze conclusie te komen Op de site gezondheitnl worden als bron de EAACI en Allergiesite genoemd terwijl deze laatste site niet bestaat en een woordvoerder van de EAACI kent deze cijfers niet Ook de andere bron heeft cijfers gebruikt die niet worden herkend Hooikoortscijfers zijn bijzonder lastig om een schatting over te maken omdat zez varieren per jaar en seizoensgebonden zijn Ook zijn er gedurende het hele jaar op hooikoorts lijkende klachten die wel onderscheiden moeten worden Vaak wordt in een algemene allergie zoals een neusallergie geen onderscheid gemaakt tussen hooikoorts en andere vormen Daarnaast is het niet mogelijk o de prevalentie van hooikoorts in Nederland te bepalen De bronnen waar kleenes zich op zegt te baseren zijn dus niet controleerbaar Wel is vast te stellen dat het aantal mensen met hooikoorts in Nederland toenam","vwo",9,189
"190","Volgens nextcheckt is de bewering van kleenex ongefundeerd Dit komt ten eerste door Kleenex uitspraken die zijn gebaseerd op eigen onderzoek waarvan de informatie en de bronnen waar deze informatie van afkomstig is niet controleerbaar is De door Kleenex gebruikte bronnen blijken de gegeven cijfers niet te herkennen Bovendien is het bijzonder lastig om een schatting te maken van het aantal mensen met hooikoorts niemand houdt de aantallen bij want de klachten zijn seizoensgebonden en varieren per jaar Over klachten gesproken klachten die aan hooikoorts worden gekoppeld moeten worden onderscheiden van de klachten van hyperreactieve rhinitis wat het hele jaar voorkomt Echter lijken deze klachten op elkaar dus onderscheid maken is hierbij een moeilijke opgave Ook is het moeilijk om in te schatten in hoeverre de prevalentie van hooikoorts in Nederland ontwikkeld is Lang niet iedereen brengt een bezoek aan de huisarts en alleen deze kunnen worden geregistreerd Wel is het zo dat de groei van het aantal bij de huisarts geregistreerde gevallen al vanaf het jaar aan het afnemen is Op grond van al deze gegevens beoordeelt nextcheck de uitspraak als ongefundeerd","vwo",10,190
"191","Er is inderdaad onderzoek gedaan naar het aantal hooikoortspatienten maar de betrouwbaarheid ervan is niet groot Zo worden er cijferrs bekend gemaakt die door de woordvoerder van het onderzoek niet herkend wordenOok worden er cijfers naar buiten gebracht door bronnen waarvan later blijkt dat ze er helemaal geen onderzoek naar gedaan hebben Dan is er nog de herkenning van hooikoorts veel menden hebben last rhinitis maar is dat wel seizoensgebonden allergische rhinitis Ook ademhalingsallergien zijn onderzocht maar het aandeel van hooikoorts daarin niet Al met al is het lastig om een schatting te maken van het aantal hooikoortspatienten aangezien de klachten seizoensgebonden zijn en per jaar varieren en de onderzoeken ernaar niet betrouwbaar","vwo",7,191
"192","De uitspraak van kleenex een op de mensen heeft last van hooikoorts en dat aantal groeit drastisch is ongefundeerd Dit heeft een aantal redenen De uitspraken van kleenex zijn gebaseerd op eigen onderzoek samen met de University of Worcester Deze gegevens kunnen niet worden gedeeld Ook de bronnen Gezondheidsnetnl en Bioharma die kleenex heeft geraadpleegt blijken onbetrouwbaar Daarnaast is het aantal mensen wat hooikoorts heeft lastig vast te stellen de klachten zijn seizoensgebonden en varieren per jaar en moeten worden omderscheiden van soortgelijke klachten die het hele jaar voorkomen De onderzoeken van het Nationaal Kompas Volksgezondheid van RIVM en World Allergy Organization zijn dus niet betrouwbaar Ook is de prevalentie van hooikoorts niet voor te bepalen omdat niet ieder naar de huisarts gaat waardoor de uitspraken van het CMR niet betrouwbaar zijn","vwo",9,192
"193","De bewering van Kleenex is om verschillende redenen ongefundeerd Ten eerste zou Kleenex de cijfers van hun uitspraak uit eigen onderzoek hebben gehaald Dit onderzoek is bovendien gebasseerd op een aantal bbronnen die niet helemaal betrouwbaar waren zoals van EAACI en het KNMI Ten tweede is het erg lastig om een schatting te maken van het aantal hooikoortspatienten Dit komt doordat deze allergie seizoensgebonden is Ook is het moeilijk om bijvoorbeeld een neusallergie of hooikoorts te onderscheiden Verder is het lastig om dit gegeven te halen uit het aantal gediagnosticeerde huisartsbezoekjes omdat lang niet iedereen naar de huisarts gaat Bovendien zijn deze cijfers recent Al met al zijn er genoeg redenen om deze bewering ongefundeerd te verklaren","vwo",8,193
"194","Volgens een onderzoek van kleenex en de University of Worcester blijkt dat een op de vijf mensen last heeft van hooikoorts Hierbij gebruiken ze bronnen van Gezondheidsnetnl en een persbericht van Bioharma met als bron de KNMI DE KNMI en Gezondheidsnet blijken deze gegevens niet verstrekt te hebben en weten niets van de genoemde cijfers Het is ook zeer moeilijk om een schatting te maken van de genoemde zijfers Bij andere verschillende onderzoeken is wel geconstateerd hoeveel mensen er neusallergie en dergelijke hebben maar ook hieruit kan niet worden gedefinieerd hoeveel mensen last hebben van hooikoorts De bronnen die Kleenex beweert gebruikt te hebben zijn al met al helaas oncontroleerbaar","vwo",8,194
"195","Nextcheckt heeft de bewering van Kleenex als ongefundeerd beoordeelt Zij hebben dit gedaan omadt neimand het aantal groeiende hooikoorts mensen bij houdt per jaar en doktersbezoek vaak niet nodig is omdat men zelf aan de medicijnen kan komen zonder recept Onder de bronnen van Kleenex valt onder andere de EAACI terwijl die de cijfers niet herkent en een site die inmiddels niet langer bestaat In Finland groeit het wel met maar dat hoeft in Nederland niet het geval te zijn Verder blijken de bronnen van Kleenex oncontroleerbaar en zijn de geregistreerde doktersbezoeken om hooikoorts de laatste jaren afgenomen Hieruit beoordeelt nextcheckt de bewering als ongefundeert","vwo",10,195
"196","Kleenex zegt dat het aantal mensen met hooikoorts heel hoog is en ook drastisch stijgt Hiervoor hebben ze gegevens gebruikt om het te onderzoeken Zo hebben ze een onderzoek gedaan met de University of Worcester maar deze gegevens vertellen niet wat Kleenex zegt Daarnaast heeft Kleenex informatie uit een artikel van Gezondheidsnetnl gebruikt deze bron zegt dat het inderdaad hoog is maar de bron van wie de wite de info heeft ontkent de gegevens te hebben Ook de andere bron van Kleenex Bioharma heeft met de gegevens geknoeid Bioharma zegt het van de KNMI te hebben maar de KNMI zegt daar deen gegevens over te hebben of tewel kleenex heeft onbetrouwbare bronnen gebruikt daarmee is de stelling ongefundeerd","vwo",6,196
"197","Hooikoorts een groeiend probleem Het bedrijf Kleenex zegt van wel maar hun onderzoek is ongefundeerd De geraadpleegde bronnen zijn niet betrouwbaar Zij hebben foutieve informatie van een niet langer bestaande site en cijfers van een niet uitgevoerd onderzoek van het EAACI Tevens zegt het KNMI geen hooikoortscijfers te hebben terwijl er wel cijfers gepubliceerd zijn in een persbericht van Bioharma Van echte cijfers kun je ook bijna niet spreken Klachten varieren per seizoen en per jaar Ook zien mensen hyperreactieve rhinitis als hooikoorts wat voor eventuele cijfers misleidend is De bronnen van Kleenex zijn dus niet controleerbaar Het CMR heeft data tot verzameld dus deze zijn ook achterhaald Er zijn dus heen officiele cijfers beschikbaar en het interne onderzoek wordt ook niet geopenbaard Hierdoor acht NRC checkt dit onderzoek ongefundeerd","vwo",11,197
"198","Volgens een woordvoerder van Kleenex zijn de resultaten van het onderzoek gebaseerd op een samenwerking met de University of Worcester na een artikel uit van gezondheidsnetnl en een persbericht van een fabrikant van homeopathische geneesmiddelen Deze bronnen zijn echter niet te controleren Op de pagina van gezondheidsnetnl is wel het artikel gevonden alleen de bronnen van dat artikel bestaan niet langer of zijn niet meer toegankelijk De bewering bestaat uit twee delen een op de vijf Nederlanders heeft hooikoorts en dat aantal groeit sterk dezen zijn echter moeilijk te bewijzen omdat er geen precieze cijfers worden bijgehouden van het aantal hooikoortspatienten en de cijfers die er zijn zijn niet specefiek op hooikoorts gericht de cijfers die wel specefiek voor hooikoorts zijn zijn onbetrouwbaar omdat niet iedereen daarvoor naar de huisarts","vwo",9,198
"199","Kleenex baserde cijfers uit een Europees onderzoek die niet als waarheid voor Nederland kan worden vatgesteld De cijfers van GEzondheidsnetnl word gebaseerd op cijfers van EAACI deze zeggen zijfers niet te herkennen Het persbericht van Bioharma kwamen van KNMI deze zeggen echter geen cijfers bij te houden Niemand houdt aantallen hooikoorts bij daarom is het lastig om schatting te maken Cijfers van onderzoeken maken geen onderscheid in hoevere hooikoorts aandeel in cijers had Daarnaast moeten hooikoorts lijkende klachten en hooikoorts onderscheiden worden Cijfers over hooikoorts zijn niet mogelijk in Nederland om te bepalen en zijn niet controleerbaar De bronnen van Klinex zijn dus oncontroleerbaar en is de uitspraak onvoldoende gefundeerd","vwo",10,199
"200","Kleenix gebruikt als bronnen onder andere een artikel van Gezondheidsnetnl en een persbericht van Biohorma De informatie die hier in staat zou van het KNMI en van het EAACI komen maar deze beweren beiden de cijfers niet te herkennen De bronnen zijn dus onbetrouwbaar Daarbij is een groeiens aantal gevallen van hooikoorts bijna niet te meten omdat de klachten meestal niet erg genoeg zijn om naar de huisarts te gaan De hooikoortsgevallen worden niet goed bij gehouden omdat de klachten seizoensgebonden zijn en varieren per jaar Ook zijn de cijfers die er zijn onnauwkeurig omdat hooikoorts makkelijk wordt verward met andere ademhalingsallergien zoals hyperreactieve rhinitis Volgens het CMR rapport over hooikoorts neemt het aantasl gediagnosticeerde hooiokoortsgevallen zelfs af Cijfers in hooikoorts gevallen zijn over het algemeen onnauwkeurig omdat de omdat de prevalentie van hooikoorts in Nederland moeilijk te bepalen is Het rapport van het CMR gaat maar tot dus er zijn geen accurate zijfers beschikbaar ook is het interne onderzoek van Kleenex niet inzichtelijk gemaakt","vwo",14,200
"201","De uitspraak van Kleenex is ongefundeerd want kleenex heeft bij eigen onderzoek een tweetal bronnen geraadpleegd die niet controleerbaar zijn Een aantal woordvoerder zegt decijfers neit te herkennen Ten tweede is het lastig om een schatting te maken van het aantal mensen met hooikoorts want de klachten zijn seizoensgebonden en varieren per jaar Doktersbezoek is vaak niet nodig en medicijnen zijn zonder recept verkrijgbaar Daarnaast moet de hooikoorts onderscheiden worden van op hooikoorts lijkende klachten die het hele jaar door voorkomen Ook is er onderzoem gedaan naar neusallergieen aar daarbij wordt geen onderscheid gemaakt tussen hooikoorts en andere vormen Dit geldt ook voor het onderzoek naar ademhalingsallergie Het aantal diagnoses van hooikoorts is wel toegenomen maar een verdubbeling is onwaarschijnlijk Voor Nederland zijn er geen accurate cijfers beschikbaar over het aantal mensen met hooikoorts en het onderzoek van kleenex is niet inzichtelijk gemaakt De uitspraak is dus ongefundeerd","vwo",11,201
"202","Kleenex beweert op de mensen heeft last van hooikoorts en dat is misschien verdubbelt in de laatste jaar De term hooikoorts is lastig vast te stellen de klachten zijn bij hooikoorts seizoensgebonden en veel allergien die op hooikoorts lijken komen het hele jaar voor Kleenex heeft een intern onderzoek wat niet controleerbaar is De twee andere bronnen kloppen niet Het KNMI wordt als bron genoemd maar zegt zelf geen cijfers bij te houden Gezondheidsnetnl beroept zich op bronnen waarvan bron nergens vanaf weet en de ander niet meer bestaat Het RIVM schat dat op de mensen ademhalingsallergie heeft Een andere bron zegt Deze maken het onderscheid echter niet naar hooikoorts Het CMR houdt doktersbezoeken ivm hooikoorts bij Maarniet iedereen met hooikoorts gaat naar de dokter dus dat geeft een vertekent beeld Er zijn dus geen goede cijfers over hooikoorts dus als het intern kleenex onderzoekniet gepubliceert wordt kan de bewering niet kloppen","vwo",11,202
"203","De bewering van Kleenex is ongefundeerd en niet controleerbaar wat hooikoortspatienten in Nederland betreft Ten eerste beroepte kleenex zich op een Europees onderzoek waaruit een stijging van tot procent bleekOok baseerde Kleenex zich op GezondheidsnetNL en werden als bronnen de EAACI en AllergiesiteNL genoemd waarvan de laatstes site niet meer bestaat en een woordvoerder van de EAACI zegt de cijfers niet te kennen Ook is het cijfer van hooikoortsgetallen moeilijk bij te houden want niemand houdt de getallen bij Daarnaast heeft volgens het RIVM eenderde van de Nederlandse bevolking last van neusallergie maar er wordt geen uitsluitsel gegeven over de onderscheid tussen hooikoorts en andere vormen Kortom de cijfers zijn niet controleerbaar en kunnen daarom makkelijk afwijken van de cijfers van kleenex","vwo",9,203
"204","Kleenex beweert dat een op de vijf mensen last heeft van hooikoorts en dat het aantal drastisch groeit Nextcheckt beoordeelt de uitspraak als ongefundeerd Ten eerste zijn de bronnen waar Kleenex zich zegt op te baseren niet controleerbaar Kleenex gebruikt onderzoeken van verschillende instanties terwijl de instanties zelf niets van de onderzoeken afweten Ten tweede is het bijzonder lastig om een schatting te maken van het aantal mensen met hooikoorts in nederland Niemand houdt de aantallen bij doktersbezoek is niet nodig en medicijnen zijn zonder recept verkrijgbaar Daarnaast is de diagnose lastig te stellen Is het hooikoorts of heeft de patient last van hooikoorts lijkende klachten Er zijn dus geen accurate cijfers beschikbaar van Nederland Het onderzoek van Kleenex is daarnaast nooit inzichtelijk gemaakt Op grond van al deze gegevens beoordeetl Nextcheckt de uitspraak als ongefundeerd","vwo",11,204
"205","Nextcheckt Een op de vijf mensen heeft hooikoorts en dat aantal stijgt drastisch Thomas Rueb De redactie van NextCheckt beoordeelt de bewering van Kleenex als ongefundeerd De bronnen van Kleenex zijn niet controleerbaar Niemand kan de exacte aantallen van het aantal hooikoortspatienten bijhouden Ook is het zo dat het discutabel is wanneer er sprake is van hooikoorts Er wordt namelijk geen onderscheid gemaakt tussen hooikoorts en anedre vormen van neusallergie Ook is het aantal bij de huisarts geregistreerde gevallen van hooikoorts sinds afgenomen Op grond van al deze gegevens heeft de redactie de bewering van Kleenex ongefundeerd verklaard","vwo",6,205
"206","NRCnext vind de bewering van kleenex ongefundeerd ten eerste omdat Kleenex de resultaten van haar onderzoek niet openbaar wil maken Daarnaast blijken de andere gebruikte bronnen niet betrouwbaar Het is ook heel moeilijk om goed onderzoek naar het aantal hooikoortspatienten te doen dat komt doordat er veel vergelijkbare alergien zijn en omdat men met hooikoortsklachten niet direct naar de huisarts hoeft Ondanks dat in de periode een stijging in het aantal hooikoortspatienten bij de huisarts heeft plaatsgevonden is het niet waarschijnlijk dat dit aantal verdubbeld is In de periode nam dit aantal weer af en er zijn geen gegevens van na bekend","vwo",11,206
"207","De bewering van Kleenex bestond uit twee delen Het eerste deel stelde dat een op de vijf mensen hooikoorts heeft Dit is ongefundeerd omdat de cijfers die door Kleenex genoemd worden uit onderzoeken komen die niet plaats hebben gevonden of neit meer terug te vinden zijn Ook stelt Kleenex cijfers uit Finland gelijk dan die van Nederland terwijl deze cijfers in Nederland heel anders kunnen zijn Als tweede beweerde Kleenex ook dat het aantal hooikoortspatienten drastisch stijgt Dit is ongefundeerd omdat het aantal tussen en juist afnam en er sinds geen onderzoek meer is gedaan door het CMR naar dit aantal Twee zaken die ook nog meespelen zijn dat het lastig te bepalen is of iemand echt hooikoorts heeft en dat het onderzoek dat de universiteit van worcester niet openbaar is gemaakt en dus niet gecontroleerd kan worden","vwo",11,207
"208","De cijfers van Kleenex zijn gebaseerd op twee bronnen een artikel uit van Gezondheidsnetnl en een persbericht van Biohorma Het artikel van Gezondheidsnet heeft als bronnen de Europese Academie van Allergieen EAACI en Allergiesitenl Die laatste bestaat niet meer en het aantal EAACI zegt het zijfer niet te herkennen Het persbericht van Biohorma heeft als bron het KNMI maar het KNMI zegt geen hooikoortscijfers te hebben Daarnaast is het zowiezo heel lastig een goede schatting te maken van het aantal mensen met hooikoorts want niemand houdt de aantallen bij doktersbezoek is vaak niet nodig Men kan wel kijken of het aantal diagnozes van hooikoorts toeneemt De cijfers van het CMR over de gediagnosticeerde gevallen kunnen op een toename wijzen maar zeker geen verdubbeling De uitspraak van Kleenex is dus ongefundeerd","vwo",11,208
"209","Kleenex beweert dat de hooikoorts is verdubbeld laatste jaar op de mensen heeft het redactie nextcheckt zegt dat de bewering ongefuneerd is Kleenex zal hebben samengewerkt met Uni of Worcester Het onderzoek is alleen voor intern zichtbaar Er staat in dat hooikoorts tot toeneemt per jaar Ze hebben als bron Gezondheidsnetnl gebruikt Ook EAACI en Allergiesitenl Alleen bestaat de laatste niet en schijnt dat EAACI de cijfers niet herkennen Het persbericht van Biohorma wat zegt dat het aantal hooikoortspatienten in was behoort volgens woordvoerder bij KNMI maar die schijnt geen hooikoortscijfer te hebben Het is moeilijk om zon schatting te maken want je hebt twee soorten hooikoorts seizoen en het hele jaar door Het NKV schat op basis van bevolkingsonderzoek dat van Nederlandse bevolking last heeft hierin geen onderscheid hooikoorts en andere vormen In finland was wel dat betekent niet dat het in Nederland zo is niet iedereen in Nederland gaat ook ermee naar de huisarts Het is dus niet goed vast te stellen Het onderzoek van kleenex is niet controleerbaar","vwo",13,209
"210","Kleenex gebruikt bronnen die valse cijfers bevatten Want na een controle van nextcheckt blijkt niemand deze cijfers te herkennen Daarnaast is het erg moeilijk om te schatten hoeveel Nederlanders hooikoorts hebben Het is dus ook lastig om te bepalen of de hoeveelheid personen met hooikoorts stijgt De cijfers van mensen met hooikoorts is ook moeilijk te bepalen doordat je geen doktersrecept nodig hebt voorje hooikoorts allergie En daarbij komt ook nog dat hooikoorts seizoensgebonden is en het per jaar verschild De cijfers zijn eigenlijk niet te bepalen het is in ieder geval moeilijk te bepalen","vwo",4,210
"211","De uitspraken zijn gebaseerd op eigen onderzoek en na onderzoek van Kleenes zelf lijken de resultaten niet overeen te komen Zo zegt woordvoerder van het EAACI het cijfer niet te herkennen en de opgegeven bron het KNMI zegt er geen cijfers over te hebben Verder is het moeilijk zeker te zijn van het percentage hooikoorts lijders omdat medicijnen zonder recept te halen zijn en het sterk op andere allergieen lijkt De groei van het aantal huisarts gediagnoseerde gevallen neemt sinds af De bron CMR heeft geen recentere getallen dan ","vwo",9,211
"212","Dagblad Spits melde laatst op de voorpagina dat Hooikoorts zijn hoogtepunt had bereikt Zakdoekjesproducent Kleenex waarvan de advertentie afkomstig was gaf aan dat een op de vijf mensen lst had van hooikoorts en dat het aantal drastisch groeit De redactie van nextcheckt zocht dit uit en beoordeelde de bewering als ongefundeerd Kleenex gebruikt voor zijn bewering en dergelijken bronnen Echter is bij geen van die bronnen sprake van juiste enof herkende cijfers of statistieken Er zijn echter wel cijfers bekend van onderzoeken waarbij procent van de Nederlandse bevolking last zou hebben van ademhalingsproblemen Echter is hierbij niet bekend welk aandeel daarvan Hooikoorts heeft Er heeft zeker een toename van Hooikoorts patienten plaats gevonden in de laatste jaren Maar deze toename blijkt veel kleiner te zijn dan de advertentie van Kleenex claimt","vwo",8,212
"213","Een op de vijf mensen heeft last van hooikoorts en dat aantal groeit drastisch Volgens de zakdoekjes produccent Kleenex De redactie van Nextcheckt onderzocht deze beweringen en noemde ze ongefundeerd Kleenex beweerde de informatie te hebben onderzocht in samenwerking met de University of Worcester Zij hebben de informatie uit Europees onderzoek wat een groei van per jaar aantoonde Maar dit onderzoek wees weer alle kanten op zo wees het naar Gezondheidsnetnl die wees naar Het EAACI die niets herkende maar ook naar een homepatische fabrikant die een groei tussen en beweerde Maar wanneer heeft iemand hooikoorts of ook wel allergische rihinitis een allergishe reactie op grassen en pollen wat voornamelijk voorkomt in de lente Het RIVM schat dat een derde van de bevolking hooikoorts heeft Maar dit is onmogelijk te bepalen want lang niet iedereen gaat naar de dokter met klachten over hooikoorts de medicijnen zijn gemakkelijk te verkrijgen zonder dokter Nextcheckt vind dan ook dat de cijfers ongefundeerd zijn en dat je hier niet je conclusies over kunt trekken omdat het seizoensgebonden is en mensen niet altijd naar de dokter gaan met hun klachten ","vwo",7,213
"214","Er zijn een aantal redenen waarom de redactie nextcheckt de bewering van KleenexEen op de vijf mensen heeft last van hooikoorts en dat aantal groeit drastisch als ongefundeerd oordeelt Kleenex baseert dit op bronnen die niet controleerbaar zijn Bovendien houdt niemand aantallen bij want de klachten zijn seizoensgebonden en varieren per jaar Wel wordt door het CMR gediagnotiseerde gevallen van hoooikoorts verzamelt maar die bieden geen uitsluitsel omdat niet iedereen met hooikoorts een arts bezoekt Daarnaast wordt hooikoorts niet onderscheden van op hooikoorts lijkende klachten","vwo",6,214
